-----> DML COMMANDS:- 
DATA MANIPULATION LANGUAGE:-



INSERT:-
---- AP-1
SYNTAX:- insert into table-name(column-name,column-name2,....column-name n)
values(value-1,value2,value3........value n);

insert into employees values()

---> UPDATE:-
----
Update table-name set column-name=value where some condition;

---> DELETE:- DELETE THE RECORDS BASED ON SOME CONDITION
--- SYNTAX:-
--- delete from table-name where some-condition.

--->TRUNCATE
--- Removes all records present in a table
SYNTAX:-
truncate table table-name;


---> drop deletes entire table structure and records whereas
---> truncate delete only records and doesn't affect the table structure




1. DROP
--- DEFINITION:- removes the table or object
1. table structure + data
2. table structure removed
3. performance is slow(due to full removal)

2. DELETE
DEFINITION:- removes specific rows from a table
1. specific rows(based on condition)
2. table structure intact
3. performance is slower (row-by-row)

3.TRUNCATE
DEFINITION:- removes all rows, keeps structure
1. all rows
2. table structure intact
3. performance is fast(bulk deletion)
mysql> show tables;
+----------------+
| Tables_in_pfs6 |
+----------------+
| company_staff  |
+----------------+
1 row in set (0.00 sec)






mysql> create table employees(
    -> emp_id int,
    -> firstname varchar(50),
    -> lastname varchar(50),
    -> age int,
    -> DOJ date,
    -> address tinytext,
    -> dept varchar(50)
    -> );
Query OK, 0 rows affected (0.04 sec)

mysql> insert into employees(emp_id, firstname,lastname,age,DOJ, address,dept) values (101,'Sai Siva Yashaswi','Surige',24,2026-09-05,'Vsp','IT');
ERROR 1292 (22007): Incorrect date value: '2012' for column 'DOJ' at row 1
mysql> insert into employees(emp_id, firstname,lastname,age,DOJ, address,dept) values (101,'Sai Siva Yashaswi','Surige',24,'2026-09-05','Vsp','IT');
Query OK, 1 row affected (0.04 sec)

mysql> select * from employees;
+--------+-------------------+----------+------+------------+---------+------+
| emp_id | firstname         | lastname | age  | DOJ        | address | dept |
+--------+-------------------+----------+------+------------+---------+------+
|    101 | Sai Siva Yashaswi | Surige   |   24 | 2026-09-05 | Vsp     | IT   |
+--------+-------------------+----------+------+------------+---------+------+
1 row in set (0.00 sec)

mysql> insert into employees(emp_id, firstname,lastname,age,DOJ, address,dept) values (102,'Sai Siva','Sarkar',25,'2027-09-05','HYD','HR');
Query OK, 1 row affected (0.03 sec)

mysql> select * from employees;
+--------+-------------------+----------+------+------------+---------+------+
| emp_id | firstname         | lastname | age  | DOJ        | address | dept |
+--------+-------------------+----------+------+------------+---------+------+
|    101 | Sai Siva Yashaswi | Surige   |   24 | 2026-09-05 | Vsp     | IT   |
|    102 | Sai Siva          | Sarkar   |   25 | 2027-09-05 | HYD     | HR   |
+--------+-------------------+----------+------+------------+---------+------+
2 rows in set (0.00 sec)

mysql> insert into employees values(103,'Muktha','Alluri',26,'28-10-21','Vjd','Financial')
    -> insert into employees values(103,'Muktha','Alluri',26,'28-10-21','Vjd','Financial');
ERROR 1064 (42000): You have an error in your SQL syntax; check the manual that corresponds to your MySQL server version for the right syntax to use near 'insert into employees values(103,'Muktha','Alluri',26,'28-10-21','Vjd','Financia' at line 2
mysql> insert into employees values(103,'Muktha','Alluri',26,'28-10-21','Vjd','Financial');
Query OK, 1 row affected (0.01 sec)

mysql> insert into employees values(104,'Sai','vardhan',36,'2018-02-03','Admin');
ERROR 1136 (21S01): Column count doesn't match value count at row 1
mysql> insert into employees values(104,'Sai','vardhan',36,'2018-08-20','Admin');
ERROR 1136 (21S01): Column count doesn't match value count at row 1
mysql> insert into employees values(104,'Sai','vardhan',36,'2018-08-20','Chennai','Admin',);
ERROR 1064 (42000): You have an error in your SQL syntax; check the manual that corresponds to your MySQL server version for the right syntax to use near ')' at line 1
mysql> insert into employees values(104,'Sai','vardhan',36,'2018-08-20','Chennai','Admin');
Query OK, 1 row affected (0.03 sec)

mysql> select*from employees;
+--------+-------------------+----------+------+------------+---------+-----------+
| emp_id | firstname         | lastname | age  | DOJ        | address | dept      |
+--------+-------------------+----------+------+------------+---------+-----------+
|    101 | Sai Siva Yashaswi | Surige   |   24 | 2026-09-05 | Vsp     | IT        |
|    102 | Sai Siva          | Sarkar   |   25 | 2027-09-05 | HYD     | HR        |
|    103 | Muktha            | Alluri   |   26 | 2028-10-21 | Vjd     | Financial |
|    104 | Sai               | vardhan  |   36 | 2018-08-20 | Chennai | Admin     |
+--------+-------------------+----------+------+------------+---------+-----------+
4 rows in set (0.00 sec)

mysql> insert into employees
    -> values
    -> (105,'Sai','Vardhan',28,'2029-12-28','Coimbature','Sales'),
    -> (106,'Balu','Subbu',35,'2011-04-11','kolkata','Trainee');
Query OK, 2 rows affected (0.03 sec)
Records: 2  Duplicates: 0  Warnings: 0

mysql> select*from employees;
+--------+-------------------+----------+------+------------+------------+-----------+
| emp_id | firstname         | lastname | age  | DOJ        | address    | dept      |
+--------+-------------------+----------+------+------------+------------+-----------+
|    101 | Sai Siva Yashaswi | Surige   |   24 | 2026-09-05 | Vsp        | IT        |
|    102 | Sai Siva          | Sarkar   |   25 | 2027-09-05 | HYD        | HR        |
|    103 | Muktha            | Alluri   |   26 | 2028-10-21 | Vjd        | Financial |
|    104 | Sai               | vardhan  |   36 | 2018-08-20 | Chennai    | Admin     |
|    105 | Sai               | Vardhan  |   28 | 2029-12-28 | Coimbature | Sales     |
|    106 | Balu              | Subbu    |   35 | 2011-04-11 | kolkata    | Trainee   |
+--------+-------------------+----------+------+------------+------------+-----------+
6 rows in set (0.00 sec)

mysql> -- how to insert specific values;
mysql> insert into employees(emp_id,firstname,age,address,dept)
    -> values
    -> (107,'Hari',30,'Noida','Mentor');
Query OK, 1 row affected (0.01 sec)

mysql> select * from employees;
+--------+-------------------+----------+------+------------+------------+-----------+
| emp_id | firstname         | lastname | age  | DOJ        | address    | dept      |
+--------+-------------------+----------+------+------------+------------+-----------+
|    101 | Sai Siva Yashaswi | Surige   |   24 | 2026-09-05 | Vsp        | IT        |
|    102 | Sai Siva          | Sarkar   |   25 | 2027-09-05 | HYD        | HR        |
|    103 | Muktha            | Alluri   |   26 | 2028-10-21 | Vjd        | Financial |
|    104 | Sai               | vardhan  |   36 | 2018-08-20 | Chennai    | Admin     |
|    105 | Sai               | Vardhan  |   28 | 2029-12-28 | Coimbature | Sales     |
|    106 | Balu              | Subbu    |   35 | 2011-04-11 | kolkata    | Trainee   |
|    107 | Hari              | NULL     |   30 | NULL       | Noida      | Mentor    |
+--------+-------------------+----------+------+------------+------------+-----------+
7 rows in set (0.00 sec)

mysql> select * from employees where emo_id = 104;
ERROR 1054 (42S22): Unknown column 'emo_id' in 'where clause'
mysql> select * from employees where emp_id = 104;
+--------+-----------+----------+------+------------+---------+-------+
| emp_id | firstname | lastname | age  | DOJ        | address | dept  |
+--------+-----------+----------+------+------------+---------+-------+
|    104 | Sai       | vardhan  |   36 | 2018-08-20 | Chennai | Admin |
+--------+-----------+----------+------+------------+---------+-------+
1 row in set (0.00 sec)

mysql> -- syntax for update is : update table-name set column-name-value where some condition;
mysql> update employees set lastname = kumar where emp_id = 104;
ERROR 1054 (42S22): Unknown column 'kumar' in 'field list'
mysql> update employees set lastname = kumar where emp_id = 105;
ERROR 1054 (42S22): Unknown column 'kumar' in 'field list'
mysql> update employees set lastname = 'kumar' where emp_id = 105;
Query OK, 1 row affected (0.01 sec)
Rows matched: 1  Changed: 1  Warnings: 0

mysql> select* from employees;
+--------+-------------------+----------+------+------------+------------+-----------+
| emp_id | firstname         | lastname | age  | DOJ        | address    | dept      |
+--------+-------------------+----------+------+------------+------------+-----------+
|    101 | Sai Siva Yashaswi | Surige   |   24 | 2026-09-05 | Vsp        | IT        |
|    102 | Sai Siva          | Sarkar   |   25 | 2027-09-05 | HYD        | HR        |
|    103 | Muktha            | Alluri   |   26 | 2028-10-21 | Vjd        | Financial |
|    104 | Sai               | vardhan  |   36 | 2018-08-20 | Chennai    | Admin     |
|    105 | Sai               | kumar    |   28 | 2029-12-28 | Coimbature | Sales     |
|    106 | Balu              | Subbu    |   35 | 2011-04-11 | kolkata    | Trainee   |
|    107 | Hari              | NULL     |   30 | NULL       | Noida      | Mentor    |
+--------+-------------------+----------+------+------------+------------+-----------+
7 rows in set (0.00 sec)

mysql> select * from employees where emp_id = 105;
+--------+-----------+----------+------+------------+------------+-------+
| emp_id | firstname | lastname | age  | DOJ        | address    | dept  |
+--------+-----------+----------+------+------------+------------+-------+
|    105 | Sai       | kumar    |   28 | 2029-12-28 | Coimbature | Sales |
+--------+-----------+----------+------+------------+------------+-------+
1 row in set (0.00 sec)

mysql> -- use delete operation from the table
mysql> -- syntax delete from table-name where some-condition;
mysql> delete from employees where emp_id = 105;
Query OK, 1 row affected (0.01 sec)

mysql> select * from employees;
+--------+-------------------+----------+------+------------+---------+-----------+
| emp_id | firstname         | lastname | age  | DOJ        | address | dept      |
+--------+-------------------+----------+------+------------+---------+-----------+
|    101 | Sai Siva Yashaswi | Surige   |   24 | 2026-09-05 | Vsp     | IT        |
|    102 | Sai Siva          | Sarkar   |   25 | 2027-09-05 | HYD     | HR        |
|    103 | Muktha            | Alluri   |   26 | 2028-10-21 | Vjd     | Financial |
|    104 | Sai               | vardhan  |   36 | 2018-08-20 | Chennai | Admin     |
|    106 | Balu              | Subbu    |   35 | 2011-04-11 | kolkata | Trainee   |
|    107 | Hari              | NULL     |   30 | NULL       | Noida   | Mentor    |
+--------+-------------------+----------+------+------------+---------+-----------+
6 rows in set (0.00 sec)

mysql> delete from employees where firstname = 'sai';
Query OK, 1 row affected (0.00 sec)

mysql> select * from employees;
+--------+-------------------+----------+------+------------+---------+-----------+
| emp_id | firstname         | lastname | age  | DOJ        | address | dept      |
+--------+-------------------+----------+------+------------+---------+-----------+
|    101 | Sai Siva Yashaswi | Surige   |   24 | 2026-09-05 | Vsp     | IT        |
|    102 | Sai Siva          | Sarkar   |   25 | 2027-09-05 | HYD     | HR        |
|    103 | Muktha            | Alluri   |   26 | 2028-10-21 | Vjd     | Financial |
|    106 | Balu              | Subbu    |   35 | 2011-04-11 | kolkata | Trainee   |
|    107 | Hari              | NULL     |   30 | NULL       | Noida   | Mentor    |
+--------+-------------------+----------+------+------------+---------+-----------+
5 rows in set (0.00 sec)

mysql> -- truncate means all records will be removed which is in the table;
mysql> -- syntax truncate table table-name;
mysql> truncate table employees;
Query OK, 0 rows affected (0.04 sec)

mysql> select * from employees;
Empty set (0.00 sec)

mysql> desc employees;
+-----------+-------------+------+-----+---------+-------+
| Field     | Type        | Null | Key | Default | Extra |
+-----------+-------------+------+-----+---------+-------+
| emp_id    | int         | YES  |     | NULL    |       |
| firstname | varchar(50) | YES  |     | NULL    |       |
| lastname  | varchar(50) | YES  |     | NULL    |       |
| age       | int         | YES  |     | NULL    |       |
| DOJ       | date        | YES  |     | NULL    |       |
| address   | tinytext    | YES  |     | NULL    |       |
| dept      | varchar(50) | YES  |     | NULL    |       |
+-----------+-------------+------+-----+---------+-------+
7 rows in set (0.01 sec)

mysql> drop table employees;
Query OK, 0 rows affected (0.02 sec)

mysql> desc employees;

mysql> INSERT INTO employees
    -> (emp_id, emp_name, department, job_role, salary, joining_date, city)
    -> VALUES
    -> (101, 'Ravi Kumar', 'IT', 'Developer', 45000, '2023-01-15', 'Vizag'),
    -> (102, 'Priya Sharma', 'HR', 'HR Manager', 55000, '2022-06-20', 'Hyderabad'),
    -> (103, 'Kiran Reddy', 'IT', 'Tester', 40000, '2023-03-10', 'Vizag'),
    -> (104, 'Sneha Rao', 'Finance', 'Accountant', 48000, '2021-11-25', 'Chennai'),
    -> (105, 'Arun Kumar', 'IT', 'Developer', 60000, '2020-08-18', 'Bangalore'),
    -> (106, 'Divya Reddy', 'HR', 'Recruiter', 35000, '2024-01-05', 'Vizag'),
    -> (107, 'Suresh Babu', 'Sales', 'Executive', 42000, '2022-09-12', 'Hyderabad'),
    -> (108, 'Anjali Devi', 'IT', 'Developer', 70000, '2019-05-30', 'Chennai'),
    -> (109, 'Mahesh Kumar', 'Sales', 'Manager', 65000, '2020-02-14', 'Bangalore'),
    -> (110, 'Lakshmi Rao', 'Finance', 'Analyst', 52000, '2023-07-22', 'Hyderabad');
Query OK, 10 rows affected (0.01 sec)
Records: 10  Duplicates: 0  Warnings: 0

mysql> select * from employees;
+--------+--------------+------------+------------+----------+--------------+-----------+
| emp_id | emp_name     | department | job_role   | salary   | joining_date | city      |
+--------+--------------+------------+------------+----------+--------------+-----------+
|    101 | Ravi Kumar   | IT         | Developer  | 45000.00 | 2023-01-15   | Vizag     |
|    102 | Priya Sharma | HR         | HR Manager | 55000.00 | 2022-06-20   | Hyderabad |
|    103 | Kiran Reddy  | IT         | Tester     | 40000.00 | 2023-03-10   | Vizag     |
|    104 | Sneha Rao    | Finance    | Accountant | 48000.00 | 2021-11-25   | Chennai   |
|    105 | Arun Kumar   | IT         | Developer  | 60000.00 | 2020-08-18   | Bangalore |
|    106 | Divya Reddy  | HR         | Recruiter  | 35000.00 | 2024-01-05   | Vizag     |
|    107 | Suresh Babu  | Sales      | Executive  | 42000.00 | 2022-09-12   | Hyderabad |
|    108 | Anjali Devi  | IT         | Developer  | 70000.00 | 2019-05-30   | Chennai   |
|    109 | Mahesh Kumar | Sales      | Manager    | 65000.00 | 2020-02-14   | Bangalore |
|    110 | Lakshmi Rao  | Finance    | Analyst    | 52000.00 | 2023-07-22   | Hyderabad |
+--------+--------------+------------+------------+----------+--------------+-----------+
10 rows in set (0.00 sec)
